{
  "contract_version": "1.1",
  "source_id": "f2_apptech_mru",
  "connector": "app.connectors.apptech_mru:ApptechMruConnector",
  "transport": "http_form_json",
  "dataset_grains": [
    {
      "key_pattern": "^innovation$",
      "grain_th": "นวัตกรรมหนึ่งรายการ",
      "identity_options": [["innovationid"]],
      "geography_fields": ["province", "provinceid"],
      "as_of_fields": ["updatedate", "year"]
    },
    {
      "key_pattern": "^requirement$",
      "grain_th": "ความต้องการหนึ่งรายการ",
      "identity_options": [["requirementid"]],
      "geography_fields": ["province", "provinceid"],
      "as_of_fields": ["updatedate", "year"]
    },
    {
      "key_pattern": "^news$",
      "grain_th": "ข่าวสาธารณะหนึ่งรายการ",
      "identity_options": [["newsid"]],
      "geography_fields": [],
      "as_of_fields": ["newsdate", "updatedate"]
    }
  ],
  "completeness_checks": [
    "จำนวน unique ID ต้องเท่ากับ totaldata ทุก dataset",
    "totaldata ต้องไม่เปลี่ยนระหว่าง pagination",
    "response ทุกแถวต้องเป็น object และมี ID"
  ],
  "privacy": {
    "candidate_only": true,
    "contact_value_scan": true,
    "forbidden_public_fields": ["email", "phone", "address", "token", "password", "cookie", "authorization", "citizen", "national_id"]
  },
  "sample_fixture": "tests/fixtures/connectors/f2_apptech_mru.json",
  "notes_th": "Serving ingest ดึง list JSON ให้ unique ID เท่ากับ totaldata ทุกชุด. รายละเอียดหน้า HTML (จังหวัด/ทุน/ทรัพย์สินทางปัญญา/TRL) อยู่เลนหลักฐานเมื่อ list API timeout และห้ามคัดลอกชื่อนักวิจัย"
}
