{
  "contract_version": "1.1",
  "source_id": "clig_projects",
  "connector": "app.connectors.clig_projects:CligProjectsConnector",
  "transport": "http_form_html",
  "dataset_grains": [
    {
      "key_pattern": "^projects$",
      "grain_th": "หนึ่งแถว = หนึ่งโครงการวิจัยจาก CLIG พร้อมข้อมูลหน้ารายละเอียด",
      "identity_options": [["contract_no", "project_id"], ["project_id"]],
      "geography_fields": [],
      "as_of_fields": ["fiscal_year", "fetched_at"]
    },
    {
      "key_pattern": "^policy_candidates$",
      "grain_th": "หนึ่งแถว = หนึ่งโครงการวิจัยที่ถูก tag ว่าเกี่ยวข้องกับ อปท./นโยบาย/กลไก/มาตรการ",
      "identity_options": [["contract_no", "project_id"], ["project_id"]],
      "geography_fields": [],
      "as_of_fields": ["fiscal_year", "fetched_at"]
    }
  ],
  "completeness_checks": [
    "pagination stops only on empty/no-data page or final visible page number",
    "project_id ต้องไม่ซ้ำในผลลัพธ์ projects",
    "policy_candidates เป็น subset ที่ tag จาก keyword public-interest เท่านั้น"
  ],
  "privacy": {
    "candidate_only": true,
    "contact_value_scan": true,
    "forbidden_public_fields": ["email", "phone", "address", "token", "password", "cookie", "authorization", "citizen", "national_id"]
  },
  "sample_fixture": "tests/fixtures/connectors/clig_projects.json",
  "notes_th": "ดึงเฉพาะหน้าค้นหา/รายละเอียดสาธารณะ ไม่ดึงไฟล์ PDF และไม่เก็บชื่อบุคคลใน payload"
}
